{
 "protocol_version": "1.0.0",
 "id": "audit.govern.method-distill",
 "version": "0.1.0",
 "name": "审计方法沉淀",
 "description": "沉淀优秀审计方法/技巧更新方法库；上游项目复盘，⇠ 反向赋能计划与实施阶段。",
 "kind": "analysis",
 "domains": [
  "audit",
  "compliance"
 ],
 "lifecycle": "verified",
 "compatibility": {
  "host_protocol": ">=1.0.0 <2.0.0",
  "adapters": [
   "python"
  ],
  "fallback_behavior": "human_review"
 },
 "capabilities": [
  {
   "id": "audit.govern.method-distill",
   "summary": "审计方法沉淀：沉淀优秀审计方法/技巧更新方法库；上游项目复盘，⇠ 反向赋能计划与实施阶段。",
   "side_effects": "read_only",
   "idempotency": "input_sha256 + capability_version",
   "inputs": [
    {
     "contract_id": "project-review-input",
     "version": "1.0.0",
     "format": "artifact_ref",
     "delivery": "reference",
     "classification": "audit_confidential",
     "schema_ref": "artifact-ref.schema.json",
     "max_bytes": 268435456
    }
   ],
   "outputs": [
    {
     "contract_id": "method-library",
     "version": "1.0.0",
     "format": "json",
     "delivery": "request_response",
     "classification": "audit_confidential",
     "schema_ref": "document-content.schema.json",
     "max_bytes": 67108864
    }
   ]
  }
 ],
 "governance": {
  "default_data_classification": "audit_confidential",
  "permissions": {
   "data_read": [
    "audit.govern.method-distill.read"
   ],
   "data_write": [],
   "network": "none",
   "secret_refs": []
  },
  "policy": {
   "gateway_required": true,
   "approval_required": false,
   "evidence_required": true
  }
 },
 "resources": {
  "cpu": 1,
  "memory_mb": 256,
  "gpu": "none",
  "timeout_seconds": 300
 },
 "observability": {
  "trace_required": true,
  "emits": [
   "structured_log",
   "artifact_ref",
   "audit_event"
  ],
  "health": "declared_only"
 },
 "provenance": {
  "source_refs": [
   "docs/audit-plugin-network-100.md#100",
   "docs/插件开发与接入标准-UPP-v1.0.md",
   "plugins/builtin/audit_govern_method_distill/runtime.py"
  ]
 },
 "ui": {
  "mode": "none"
 }
}