{
 "protocol_version": "1.0.0",
 "id": "audit.foundation.permission-control",
 "version": "0.1.0",
 "name": "权限管控",
 "description": "基于角色配置数据/功能访问权限；⊣ 穿透所有插件访问控制。",
 "kind": "governance",
 "domains": [
  "audit",
  "compliance"
 ],
 "lifecycle": "verified",
 "compatibility": {
  "host_protocol": ">=1.0.0 <2.0.0",
  "adapters": [
   "python"
  ],
  "fallback_behavior": "human_review"
 },
 "capabilities": [
  {
   "id": "audit.foundation.permission-control",
   "summary": "权限管控：基于角色配置数据/功能访问权限；⊣ 穿透所有插件访问控制。",
   "side_effects": "read_only",
   "idempotency": "input_sha256 + capability_version",
   "inputs": [
    {
     "contract_id": "access-request",
     "version": "1.0.0",
     "format": "artifact_ref",
     "delivery": "reference",
     "classification": "audit_confidential",
     "schema_ref": "artifact-ref.schema.json",
     "max_bytes": 268435456
    }
   ],
   "outputs": [
    {
     "contract_id": "access-decision",
     "version": "1.0.0",
     "format": "json",
     "delivery": "request_response",
     "classification": "audit_confidential",
     "schema_ref": "dataset-validation.schema.json",
     "max_bytes": 4194304
    }
   ]
  }
 ],
 "governance": {
  "default_data_classification": "audit_confidential",
  "permissions": {
   "data_read": [
    "audit.foundation.permission-control.read"
   ],
   "data_write": [],
   "network": "none",
   "secret_refs": []
  },
  "policy": {
   "gateway_required": true,
   "approval_required": false,
   "evidence_required": true
  }
 },
 "resources": {
  "cpu": 1,
  "memory_mb": 256,
  "gpu": "none",
  "timeout_seconds": 300
 },
 "observability": {
  "trace_required": true,
  "emits": [
   "structured_log",
   "artifact_ref",
   "audit_event"
  ],
  "health": "declared_only"
 },
 "provenance": {
  "source_refs": [
   "docs/audit-plugin-network-100.md#18",
   "docs/插件开发与接入标准-UPP-v1.0.md",
   "plugins/builtin/audit_foundation_permission_control/runtime.py"
  ]
 },
 "ui": {
  "mode": "none"
 }
}