{
 "protocol_version": "1.0.0",
 "id": "audit.field.workpaper-build",
 "version": "0.1.0",
 "name": "审计底稿编制",
 "description": "按审计程序编制底稿；上游程序模板与样本，调用全文检索、OCR。",
 "kind": "analysis",
 "domains": [
  "audit",
  "compliance"
 ],
 "lifecycle": "verified",
 "compatibility": {
  "host_protocol": ">=1.0.0 <2.0.0",
  "adapters": [
   "python"
  ],
  "fallback_behavior": "human_review"
 },
 "capabilities": [
  {
   "id": "audit.field.workpaper-build",
   "summary": "审计底稿编制：按审计程序编制底稿；上游程序模板与样本，调用全文检索、OCR。",
   "side_effects": "read_only",
   "idempotency": "input_sha256 + capability_version",
   "inputs": [
    {
     "contract_id": "program-template",
     "version": "1.0.0",
     "format": "artifact_ref",
     "delivery": "reference",
     "classification": "audit_confidential",
     "schema_ref": "document-content.schema.json",
     "max_bytes": 67108864
    },
    {
     "contract_id": "sample-size",
     "version": "1.0.0",
     "format": "artifact_ref",
     "delivery": "reference",
     "classification": "audit_confidential",
     "schema_ref": "metric-series.schema.json",
     "max_bytes": 16777216
    }
   ],
   "outputs": [
    {
     "contract_id": "workpaper-draft",
     "version": "1.0.0",
     "format": "json",
     "delivery": "request_response",
     "classification": "audit_confidential",
     "schema_ref": "workpaper-export.schema.json",
     "max_bytes": 67108864
    }
   ]
  }
 ],
 "governance": {
  "default_data_classification": "audit_confidential",
  "permissions": {
   "data_read": [
    "audit.field.workpaper-build.read"
   ],
   "data_write": [],
   "network": "none",
   "secret_refs": []
  },
  "policy": {
   "gateway_required": true,
   "approval_required": false,
   "evidence_required": true
  }
 },
 "resources": {
  "cpu": 1,
  "memory_mb": 256,
  "gpu": "none",
  "timeout_seconds": 300
 },
 "observability": {
  "trace_required": true,
  "emits": [
   "structured_log",
   "artifact_ref",
   "audit_event"
  ],
  "health": "declared_only"
 },
 "provenance": {
  "source_refs": [
   "docs/audit-plugin-network-100.md#50",
   "docs/插件开发与接入标准-UPP-v1.0.md",
   "plugins/builtin/audit_field_workpaper_build/runtime.py"
  ]
 },
 "ui": {
  "mode": "none"
 }
}