{
 "protocol_version": "1.0.0",
 "id": "audit.evidence.workpaper-encrypt-store",
 "version": "0.1.0",
 "name": "底稿加密存储",
 "description": "对正式底稿进行加密归档存储；调用数据加密插件，实现长期存档。",
 "kind": "analysis",
 "domains": [
  "audit",
  "compliance"
 ],
 "lifecycle": "verified",
 "compatibility": {
  "host_protocol": ">=1.0.0 <2.0.0",
  "adapters": [
   "python"
  ],
  "fallback_behavior": "human_review"
 },
 "capabilities": [
  {
   "id": "audit.evidence.workpaper-encrypt-store",
   "summary": "对正式底稿进行加密归档存储；调用数据加密插件，实现长期存档。",
   "side_effects": "read_only",
   "idempotency": "input_sha256 + capability_version",
   "inputs": [
    {
     "contract_id": "signed-workpaper",
     "version": "1.0.0",
     "format": "artifact_ref",
     "delivery": "reference",
     "classification": "audit_confidential",
     "schema_ref": "document-content.schema.json",
     "max_bytes": 268435456
    }
   ],
   "outputs": [
    {
     "contract_id": "encrypt-status",
     "version": "1.0.0",
     "format": "artifact_ref",
     "delivery": "reference",
     "classification": "audit_confidential",
     "schema_ref": "document-content.schema.json",
     "max_bytes": 268435456
    }
   ],
   "invokes": [
    "audit.foundation.data-encrypt"
   ]
  }
 ],
 "governance": {
  "default_data_classification": "audit_confidential",
  "permissions": {
   "data_read": [],
   "data_write": [],
   "network": "none",
   "secret_refs": []
  },
  "policy": {
   "gateway_required": true,
   "approval_required": false,
   "evidence_required": true
  }
 },
 "resources": {
  "cpu": 1,
  "memory_mb": 256,
  "gpu": "none",
  "timeout_seconds": 300
 },
 "observability": {
  "trace_required": true,
  "emits": [
   "structured_log",
   "artifact_ref",
   "audit_event"
  ],
  "health": "declared_only"
 },
 "provenance": {
  "source_refs": [
   "docs/audit-plugin-network-100.md",
   "docs/插件开发与接入标准-UPP-v1.0.md",
   "plugins/builtin/audit_evidence_workpaper_encrypt_store/runtime.py"
  ]
 },
 "ui": {
  "mode": "none"
 }
}
