{
 "protocol_version": "1.0.0",
 "id": "audit.plan.staff-schedule",
 "version": "0.1.0",
 "name": "审计人员排班",
 "description": "根据项目需求/人员技能匹配排班；上游项目分工，调用人力资源数据。",
 "kind": "workflow",
 "domains": [
  "audit",
  "compliance"
 ],
 "lifecycle": "verified",
 "compatibility": {
  "host_protocol": ">=1.0.0 <2.0.0",
  "adapters": [
   "python"
  ],
  "fallback_behavior": "human_review"
 },
 "capabilities": [
  {
   "id": "audit.plan.staff-schedule",
   "summary": "审计人员排班：根据项目需求/人员技能匹配排班；上游项目分工，调用人力资源数据。",
   "side_effects": "read_only",
   "idempotency": "input_sha256 + capability_version",
   "inputs": [
    {
     "contract_id": "team-scheme",
     "version": "1.0.0",
     "format": "artifact_ref",
     "delivery": "reference",
     "classification": "audit_confidential",
     "schema_ref": "workflow.schema.json",
     "max_bytes": 4194304
    }
   ],
   "outputs": [
    {
     "contract_id": "schedule-plan",
     "version": "1.0.0",
     "format": "json",
     "delivery": "request_response",
     "classification": "audit_confidential",
     "schema_ref": "workflow.schema.json",
     "max_bytes": 4194304
    }
   ]
  }
 ],
 "governance": {
  "default_data_classification": "audit_confidential",
  "permissions": {
   "data_read": [
    "audit.plan.staff-schedule.read"
   ],
   "data_write": [],
   "network": "none",
   "secret_refs": []
  },
  "policy": {
   "gateway_required": true,
   "approval_required": false,
   "evidence_required": true
  }
 },
 "resources": {
  "cpu": 1,
  "memory_mb": 256,
  "gpu": "none",
  "timeout_seconds": 300
 },
 "observability": {
  "trace_required": true,
  "emits": [
   "structured_log",
   "artifact_ref",
   "audit_event"
  ],
  "health": "declared_only"
 },
 "provenance": {
  "source_refs": [
   "docs/audit-plugin-network-100.md#45",
   "docs/插件开发与接入标准-UPP-v1.0.md",
   "plugins/builtin/audit_plan_staff_schedule/runtime.py"
  ]
 },
 "ui": {
  "mode": "none"
 }
}