{
 "protocol_version": "1.0.0",
 "id": "audit.remedy.remedy-progress-track",
 "version": "0.1.0",
 "name": "整改进度跟踪",
 "description": "实时跟踪整改执行进度；上游整改方案，自动预警逾期。",
 "kind": "analysis",
 "domains": [
  "audit",
  "compliance"
 ],
 "lifecycle": "verified",
 "compatibility": {
  "host_protocol": ">=1.0.0 <2.0.0",
  "adapters": [
   "python"
  ],
  "fallback_behavior": "human_review"
 },
 "capabilities": [
  {
   "id": "audit.remedy.remedy-progress-track",
   "summary": "整改进度跟踪：实时跟踪整改执行进度；上游整改方案，自动预警逾期。",
   "side_effects": "read_only",
   "idempotency": "input_sha256 + capability_version",
   "inputs": [
    {
     "contract_id": "remedy-plan-approved",
     "version": "1.0.0",
     "format": "artifact_ref",
     "delivery": "reference",
     "classification": "audit_confidential",
     "schema_ref": "workflow.schema.json",
     "max_bytes": 4194304
    }
   ],
   "outputs": [
    {
     "contract_id": "remedy-progress",
     "version": "1.0.0",
     "format": "json",
     "delivery": "request_response",
     "classification": "audit_confidential",
     "schema_ref": "metric-series.schema.json",
     "max_bytes": 16777216
    }
   ]
  }
 ],
 "governance": {
  "default_data_classification": "audit_confidential",
  "permissions": {
   "data_read": [
    "audit.remedy.remedy-progress-track.read"
   ],
   "data_write": [],
   "network": "none",
   "secret_refs": []
  },
  "policy": {
   "gateway_required": true,
   "approval_required": false,
   "evidence_required": true
  }
 },
 "resources": {
  "cpu": 1,
  "memory_mb": 256,
  "gpu": "none",
  "timeout_seconds": 300
 },
 "observability": {
  "trace_required": true,
  "emits": [
   "structured_log",
   "artifact_ref",
   "audit_event"
  ],
  "health": "declared_only"
 },
 "provenance": {
  "source_refs": [
   "docs/audit-plugin-network-100.md#90",
   "docs/插件开发与接入标准-UPP-v1.0.md",
   "plugins/builtin/audit_remedy_remedy_progress_track/runtime.py"
  ]
 },
 "ui": {
  "mode": "none"
 }
}