{
 "protocol_version": "1.0.0",
 "id": "audit.mandate.annual-propose",
 "version": "0.1.0",
 "name": "年度立项申报",
 "description": "立项申请与材料填报；上游需求对齐结果，下游输出至立项评审。",
 "kind": "analysis",
 "domains": [
  "audit",
  "compliance"
 ],
 "lifecycle": "verified",
 "compatibility": {
  "host_protocol": ">=1.0.0 <2.0.0",
  "adapters": [
   "python"
  ],
  "fallback_behavior": "human_review"
 },
 "capabilities": [
  {
   "id": "audit.mandate.annual-propose",
   "summary": "年度立项申报：立项申请与材料填报；上游需求对齐结果，下游输出至立项评审。",
   "side_effects": "read_only",
   "idempotency": "input_sha256 + capability_version",
   "inputs": [
    {
     "contract_id": "aligned-demand",
     "version": "1.0.0",
     "format": "artifact_ref",
     "delivery": "reference",
     "classification": "audit_confidential",
     "schema_ref": "document-content.schema.json",
     "max_bytes": 67108864
    }
   ],
   "outputs": [
    {
     "contract_id": "proposal-set",
     "version": "1.0.0",
     "format": "json",
     "delivery": "request_response",
     "classification": "audit_confidential",
     "schema_ref": "document-content.schema.json",
     "max_bytes": 67108864
    }
   ]
  }
 ],
 "governance": {
  "default_data_classification": "audit_confidential",
  "permissions": {
   "data_read": [
    "audit.mandate.annual-propose.read"
   ],
   "data_write": [],
   "network": "none",
   "secret_refs": []
  },
  "policy": {
   "gateway_required": true,
   "approval_required": false,
   "evidence_required": true
  }
 },
 "resources": {
  "cpu": 1,
  "memory_mb": 256,
  "gpu": "none",
  "timeout_seconds": 300
 },
 "observability": {
  "trace_required": true,
  "emits": [
   "structured_log",
   "artifact_ref",
   "audit_event"
  ],
  "health": "declared_only"
 },
 "provenance": {
  "source_refs": [
   "docs/audit-plugin-network-100.md#21",
   "docs/插件开发与接入标准-UPP-v1.0.md",
   "plugins/builtin/audit_mandate_annual_propose/runtime.py"
  ]
 },
 "ui": {
  "mode": "none"
 }
}