{
 "protocol_version": "1.0.0",
 "id": "audit.remedy.remedy-publish",
 "version": "0.1.0",
 "name": "整改结果公示",
 "description": "对内公示整改完成情况；调用数据脱敏，接受全员监督。",
 "kind": "governance",
 "domains": [
  "audit",
  "compliance"
 ],
 "lifecycle": "verified",
 "compatibility": {
  "host_protocol": ">=1.0.0 <2.0.0",
  "adapters": [
   "python"
  ],
  "fallback_behavior": "human_review"
 },
 "capabilities": [
  {
   "id": "audit.remedy.remedy-publish",
   "summary": "整改结果公示：对内公示整改完成情况；调用数据脱敏，接受全员监督。",
   "side_effects": "read_only",
   "idempotency": "input_sha256 + capability_version",
   "inputs": [
    {
     "contract_id": "remedy-ledger",
     "version": "1.0.0",
     "format": "artifact_ref",
     "delivery": "reference",
     "classification": "audit_confidential",
     "schema_ref": "workflow.schema.json",
     "max_bytes": 4194304
    }
   ],
   "outputs": [
    {
     "contract_id": "published-remedy",
     "version": "1.0.0",
     "format": "json",
     "delivery": "request_response",
     "classification": "audit_confidential",
     "schema_ref": "document-content.schema.json",
     "max_bytes": 67108864
    }
   ],
   "invokes": [
    "audit.foundation.data-mask"
   ]
  }
 ],
 "governance": {
  "default_data_classification": "audit_confidential",
  "permissions": {
   "data_read": [
    "audit.remedy.remedy-publish.read"
   ],
   "data_write": [],
   "network": "none",
   "secret_refs": []
  },
  "policy": {
   "gateway_required": true,
   "approval_required": false,
   "evidence_required": true
  }
 },
 "resources": {
  "cpu": 1,
  "memory_mb": 256,
  "gpu": "none",
  "timeout_seconds": 300
 },
 "observability": {
  "trace_required": true,
  "emits": [
   "structured_log",
   "artifact_ref",
   "audit_event"
  ],
  "health": "declared_only"
 },
 "provenance": {
  "source_refs": [
   "docs/audit-plugin-network-100.md#94",
   "docs/插件开发与接入标准-UPP-v1.0.md",
   "plugins/builtin/audit_remedy_remedy_publish/runtime.py"
  ]
 },
 "ui": {
  "mode": "none"
 }
}
