{
 "protocol_version": "1.0.0",
 "id": "audit.report.advice-match",
 "version": "0.1.0",
 "name": "审计建议匹配",
 "description": "针对问题类型匹配审计建议；上游问题清单，调用最佳实践库。",
 "kind": "retrieval",
 "domains": [
  "audit",
  "compliance"
 ],
 "lifecycle": "verified",
 "compatibility": {
  "host_protocol": ">=1.0.0 <2.0.0",
  "adapters": [
   "python"
  ],
  "fallback_behavior": "human_review"
 },
 "capabilities": [
  {
   "id": "audit.report.advice-match",
   "summary": "审计建议匹配：针对问题类型匹配审计建议；上游问题清单，调用最佳实践库。",
   "side_effects": "read_only",
   "idempotency": "input_sha256 + capability_version",
   "inputs": [
    {
     "contract_id": "final-issue-set",
     "version": "1.0.0",
     "format": "artifact_ref",
     "delivery": "reference",
     "classification": "audit_confidential",
     "schema_ref": "finding-draft.schema.json",
     "max_bytes": 16777216
    }
   ],
   "outputs": [
    {
     "contract_id": "advice-set",
     "version": "1.0.0",
     "format": "json",
     "delivery": "request_response",
     "classification": "audit_confidential",
     "schema_ref": "report-draft.schema.json",
     "max_bytes": 16777216
    }
   ]
  }
 ],
 "governance": {
  "default_data_classification": "audit_confidential",
  "permissions": {
   "data_read": [
    "audit.report.advice-match.read"
   ],
   "data_write": [],
   "network": "none",
   "secret_refs": []
  },
  "policy": {
   "gateway_required": true,
   "approval_required": false,
   "evidence_required": true
  }
 },
 "resources": {
  "cpu": 1,
  "memory_mb": 256,
  "gpu": "none",
  "timeout_seconds": 300
 },
 "observability": {
  "trace_required": true,
  "emits": [
   "structured_log",
   "artifact_ref",
   "audit_event"
  ],
  "health": "declared_only"
 },
 "provenance": {
  "source_refs": [
   "docs/audit-plugin-network-100.md#83",
   "docs/插件开发与接入标准-UPP-v1.0.md",
   "plugins/builtin/audit_report_advice_match/runtime.py"
  ]
 },
 "ui": {
  "mode": "none"
 }
}